55,น้ำมะเฟือง,อาหารเจ,ขั้นตอนแรก คือ คัดเลือกผลมะเฟืองสุก ที่เหมาะสำหรับนำมาทำน้ำดื่ม ล้างให้สะอาด ปลอกเปลือกมะเฟือง หั่นเอาแต่เนื้อ จากนั้นเราจะนำไปปั่น โดยให้ใส่ผลมะเฟืองสุกลงไป เทน้ำเปล่าให้ท่วมผลมะเฟือง ปั่นให้ละเอียด จกานั้นนำมาคั้นเอาน้ำมะเฟือง จะได้น้ำสีส้มๆของเนื้อมะเฟือง ซึ่งรสชาติจะออกเปรียวสามารนำมาดื่มสดๆได้ หากสามารถดื่มได้ ให้พักเอาไว้ก่อน เตรียทำน้ำเชื่อมก่อน,การทำน้ำเชื่อม ให้ เอาน้ำเปล่าต้ม ใส่น้ำตาล และ เกลือลงไป เคี้ยวจนได้รสชาติหวานกลมกล่อม,ปรุงรส น้ำมะเฟือง โดย ผสม น้ำมะเฟือง น้ำเชื่อม ให้เข้ากัน ชิ่มรสชาติตามใจชอบ,จากนั้นนำน้ำมะเฟืองไปแช่เย็น ให้ได้น้ำผลไม้ที่เย็นๆ เมื่อเย็นได้ที่ก็พร้อมสำหรับนำมาดื่มได้เลย,,,,,,,,,,,,,,
56,น้ำมะม่วง,อาหารเจ,ขั้นตอนแรกให้เลือกมะม่วงสุก นำมาล้างให้สะอาด ปอกเปลือก ฝานเอาเฉพาะเนื้อมะม่วง จากนั้นจะนำเอาไปปั่น,เตรียมน้ำเชื่อม โดยใช้น้ำสะอาด มาต้มให้เดือด และ ใส่น้ำตาลและเกลือลงไป เคี้ยวให้เหนียว จากนั้นพักให้เย็นก่อน,การปั่นน้ำมะม่วง ให้ใส่เนื้อมะม่วงสุก และ น้ำเปล่า ปริมาณท่วมเนื้อมะม่วง ปั่นให้ละเอียด จากนั้นนำไปกรองเอาเฉพาะ น้ำของเนื้อมะม่วง,นำน้ำมะม่วงมาปรุงรสกับน้ำเชื่อมจามใจชอบ จากานั้นนำไปแช่เย็น ให้เย็นฉ่ำ ก็สามารถนำมาดื่มให้ความสดชื่นได้,,,,,,,,,,,,,,
57,น้ำสับปะรด,อาหารเจ,เริ่มจากการเตรียมน้ำเชื่อม สูตริเศษ ให้ ต้มน้ำให้เดือด ใส่ น้ำตาลทรายลงไปต้ม และ ปรุงรสน้ำเชื่อมด้วยเกลือ เคี้ยวด้วยไฟอ่อนๆ ให้น้ำเชื่อมเปลี่ยนเป้นสีเหลือง ก็นำมาพักให่เย็น จากนั้นเราจะมาเตรียมน้ำสับประรดกัน โดย,ให้ปอกเปลือกสับปะรด เทคนิคการปลอกสับประรด ให้ หั่นเอาตาสับประรดออก ให้เหลือแต่เนื้อเหลืองๆ น้ำสับประรด จะมีความเป็นกรด ในการหั่นสับประรด นั้น ให้ใหส่ถุงมือป้องกันโดนน้ำสับกะรดกัดมือ,เตรียมเครื่องปั่น นำเนื้อสับปะรด ใส่น้ำเปล่าให้ท่วมเนื้อสับปะรด ปั่นให้ละเอียด จากนั้นนำมาคั้นเอาน้ำสับปะรดอย่างเดียว,ปรุงรสน้ำผลไม้ ด้วย การน้ำคั้นสับปะรด ผสมน้ำเชื่อม ปรุงความหวานของน้ำเชื่อมตามใจชอบ,นำไปแช่ตู่เย็น ให้เย็นสดชื่นๆ เสริฟน้ำผลไม้เย็นๆ,สำหรับสับปะรดที่เรานำมาทำน้ำสับปะรด ให้เลือกสับปะรดศรีราชา เนื่องจากจะมีรสชาติหวานอมเปรี้ยว เวลานำมาทำน้ำดื่มจะมีรสเปี้ยวนิดๆ หวานหน่อยๆ,ผลสับประรด ที่นำมาทำ ต้องเป็น ผลที่สุกพอดี ไม่ดิบ หรือ สุกจนจะเน่า ต้องเลือกให้ดีๆ ผลที่แข็งมากจะยังดิบอยู่ ผลที่อ่อนมากๆ จะนิ่มมาก ให้สังเกตุประมารนี้,น้ำของผลสับประรด มีฤทธิ์เป็นกรดนิดหน่อย ให้ใส่ถุงมือป้องกันโดนกัดมือ แต่ถึงจะโดนกัดมือ ก็แค่คันๆ ไม่อันตรายอะไรมาก,น้ำเชื่อมนั้น ต้องปรุงรสด้วยเกลือ ความเค็มของเกลือ จะช่วยให้น้ำเชื่อมไม่หวานเกินไป เพิ่มความกลมกล่อม การปรุงรสเกลือ นั้น ให้ใส่ทีละนิด จะกว่าจะได้รสน่้ำเชื่อมที่ตัวเองพอใจ,การดื่มน้ำผลไม้นั้น แนะนำให้แช่เย็น และดื่มแบบเย็นๆ ไม่ต้องมีน้ำแข็ง เนื่องจากน้ำแข็งจะเจือจางรสชาติลง สำหรับคนที่นิยมน้ำแข็ง ให้ปรุงรสให้เข้มข้นขึ้นอีก เนื่องจากเวลาน้ำแข็งละลายจะได้รสชาติที่พอดี,,,,,,,,
58,น้ำส้มคั้น,อาหารเจ,ผ่าครึ่ง ผลส้ม จากนั้นใช้เครื่องคั้นน้ำ คั้นเอาแต่น้ำ,ใส่ เกลือ ผสมใน น้ำส้มคั้น นำไปแช่ตู้เย็นให้เย็น,เสริฟ น้ำส้มคั้นเย็นๆ,,,,,,,,,,,,,,,
59,น้ำกระเจี๊ยบ,อาหารเจ,เริ่มการทำน้ำกะรเจี้ยบจาก เตรียมน้ำเชื่อมก่อน ต้มน้ำเปล่า ใส่น้ำตาลทราย และ เกลือ ลงไปต้ม เคี้ยวด้วยไฟอ่อนๆ ต้มจนน้ำเชื่อมออกเหลืองๆ เหนียวนิดหน่อย ก็ พร้อมสำหรับนำมาปรุงรส,ขั้นต่อไป ต้มกระเจี้ยบ โดย เลือกผลกระเจี๊ยบสุก นำไปล้างให้สะอาด จากนั้น ตั้งหม้อต้มต้มกระเจี้ยบด้วยไฟอ่อนๆ ต้มจนรสของกระเจี๊ยบออกมาอย่างเต็มที่ เมื่อได้ที่แล้ว ก็กรองน้ำต้มกระเจี๊ยบ ให้สะอาด อย่าให้มีสิ่งสกปรกเจือปน,ปรุงรสน้ำกระเจี๊ยบ ด้วยการนำน้ำต้มผลกระเจี๊ยบสุก ผสมกับน้ำเชื่อม ปรุงรสชาติตามใจชอบ,น้ำน้ำกระเจี๊ยบไปแช่เย็น ให้เย็นๆ สำหรับนำมาดื่มแบบสดชื่น,ผลกระเจี๊ยบให้เลือกผลกระเจี๊ยบสุก โดยสังเกตุผลกระเจี๊ยบสีแดง ลักษณะผลสวยงามไม่เสียรูปทรง ให้นำไปล้างให้สะอาด เนื่องจากผลกระเจียบสุกจะหวานและเหนียวส่งสกปรกจะเกาะติดง่าย,การต้มผลกระเจี๊ยบสุก ให้ตั้งน้ำต้มด้วยไฟอ่อนๆ ต้มเคี้ยวให้รสชาติของกระเจี๊ยบออกมาอย่างเต็มที่ ขั้นตอนนี้สำคัญไฟที่แรงเกินไปจะทำให้น้ำกระเจี๊ยบมีรสฝาด,น้ำต้มกระเจียบ ต้องกรองให้สะอาด อย่าให้มีสิ่งสกปรกเจือปน เนื่องจากผลกระเจี๊ยบมีฝุ่นเกาะติดง่ายต้องกรองให้สะอาด ก่อนนำมาปรุงรส,น้ำเชื่อมสำหรับนำมาทำน้ำหวาน ต้องปรุงรสด้วยเกลือ เกลือจะช่วยให้น้ำเชื่อมมีความกลมกล่อมมากขึ้น,น้ำตาล สำหรับทำเชื่อม เราเลือกใช้ น้ำตาลทรายแดง ผสมกับน้ำตาลทราย ไม่ฟองสี น้ำตาลทรายแดง จะช่วยให้ น้ำเชื่อมมี ความหวานหอม,ทุกขั้นตอน ของการทำ น้ำกระเจี๊ยบ นั้น ให้มีการกรองทุกขั้นตอน เพื่อให้ น้ำกระเจี๊ยบสะอาด ไม่มีสิ่งเจือปน ให้เสียความอร่อย,,,,,,,,
60,น้ำมะตูม,อาหารเจ,ต้มมะตูมแห้งกับน้ำเปล่า พอน้ำเริ่มออกสี ให้คั้นมะตูมกับน้ำ และ กรองเอาแต่น้ำ 1 ถ้วยตวง,ผสมกับน้ำเชื่อมและเกลือ,เสริฟน้ำมะตูมกับน้ำแข็งเย็นๆ น้ำมะตูม,,,,,,,,,,,,,,,
61,น้ำเห็ดหลินจือ,อาหารเจ,นำ เห็ดหลินจือแห้ง แช่ในน้ำให้นิ่ม,นำ เห็ดหลินจือ ต้ม กับน้ำ ประมาณ 1 – 2 ชั่วโมง,กรอง สิ่งสกปรกออก เอาแต่ น้ำสมุนไพร ใช้ดื่มแทนน้ำ ควรดื่ม น้ำเห็ดหลินจือ ใน ระดับอุณหภูมิห้อง,เห็ดหลินจือ อบแห้ง 6 กรัม ( ประมาณ10 อัน ),น้ำเปล่า อย่างน้อย 2 ลิตร,,,,,,,,,,,,,
62,น้ำตะไคร้,อาหารเจ,เริ่มการทำน้ำตะไคร้ จากการต้มน้ำเชื่อมก่อน โดย ให้นำน้ำสะอาด มาต้มให้เดือด ใส่น้ำตาลและเกลือลงไปเคี้ยว ด้วยไฟอ่อนๆ จนน้ำเชื่อมออกสีเหลืองแสดงว่าใช้งานได้,จากนั้น ต้มน้ำตะไคร้ โดย การนำต้นตะไคร้มาบุบให้แตก จากนั้นำไปต้ม โดยการต้มด้วยไฟอ่อนๆ ค่อยๆเคี้ยวจนได้กลิ่นหอม,ปรุงรสน้ำตะไคร้ โดย การผสมน้ำจากการต้มตะไคร้ กรองก่อน ผสมกับน้ำเชื่อม และ น้ำมะนาว รสชาติตามชอบ,จากนั้นนำน้ำสมุนไพรลงไปแช่เย็น ให้เย็นฉ่ำๆ เสริฟ น้ำตะไคร้เย็นๆ,ตะไคร้ ให้ ให้นำไป บุบให้แตกก่อน จะนำไปต้ม โดยต้มด้วยไฟอ่อนๆ และ จึงค่อยๆ เร่งไฟให้แรงขึ้น น้ำมันหอมระเหยของตะไคร้ จึงค่อยๆ ออกมา ได้ สรรพคุณของน้ำตะไคร้อย่างเต็มที่,การกรอง เป็น สิ่งที่สำคัญ สำหรับทำให้ เครื่องดื่มสุขภาพ จะสะอาด,น้ำตาล สำหรับ นำมาทำเครื่องดื่ม เลือกใช้น้ำตาลทรายแดง เนื่องจาก น้ำตาลทรายแดง จะให้ความเหวาน เหมาะสำหรับนำมาทำ น้ำตะไคร้,เกลือ สำหรับการใส่ เกลือนิดหน่อยในน้ำตาล จะช่วยให้ ความหวานของน้ำเชื่อมไม่ หวานแสบคอ ความเคล็มนิดหน่อย จะช่วยให้เกิดความกลมกล่อมมากขึ้น,,,,,,,,,,
63,น้ำแอปเปิ้ลเขียว,อาหารเจ,เตรียมผลแอบเปิ้ลสำหรับนำมาปั่น โดยผ่าแอปเปิลเขียว แกะเมล็ดของแอบเปิ้ลออก นำไปใส่เครื่องปั่น เติ่มน้ำเชื่อม และ เกลือลงไป นำไปปั่นให้ละเอียด,นำมากรองเอาแต่น้ำแอบเปิ้ลเขียว และ ใส่เนื้อแอบเปิ้ลเขียว 1 ช้อนโต้ะ ให้ได้สัมผัสของเนื้อน้ำผลไม้,นำน้ำแอบเปิ้ลเขียวไปแช่เย็น เวลาเสริฟให้ใส่น้ำแข็งจะเพิ่มความสดชื่นให้กับเครื่องดื่ม,,,,,,,,,,,,,,,
64,ผัดวุ้นเส้นมะละกอ,อาหารเจ,ตั้งกระทะน้ำมัน นำวุ้นเส้นและมะละกอลงไปผัด ให้สุก,ปรุงรสด้วย ซีอิ้วดำ ซีอิ้วขาว ซอสเห็ดหอม และ น้ำตาล,ใส่ แครอท และ เห็ด ลงไปผัดให้สุก เสริฟพร้อมรับประทาน,มะละกอ ใช้ มะละกอดิบ นำมาขูดเส้น มะละกอดิบ เหมาะสำหรับนำมาทำอาหารผัด เนื่องจากเส้นมีความแข็ง กรอบ หากใช้มะละกอสุก เส้นจะเละ ไม่น่ารับประทาน,วุ้นเส้น การทำอาหาร เมนูวุ้นเส้น นั้น เทคนิคการทำ ให้นำวุ้นเส้นไปแช่น้ำก่อน เพื่อให้วุ้นเส้น อิ่มน้ำ นุ่ม เหมาะสำหรับนำมาทำอาหารทุกประเภท ซึ่งวุ้นเส้น สำหรับนำมาทำ ให้เลือกใช้วุ้นเส้นจากถั่วเขียว แท้ๆ จะทำการทำอาหาร เมนูวุ้นเส้น หลายๆครั้ง มีเหมือนแป้งติดออกมาด้วย นั้นแปลว่า เราไม่ได้เลือกวุ้นเส้นแท้ การเตรียมอาหารไม่ดี,น้ำมันพืช สำหรับ นำมาผัด ให้ใช้น้ำมันพืชใหม่ อย่านำน้ำมันเก่า ที่ผ่านการใช้งานมาทำอาหาร เนื่องจาก ทำให้อาการมีกลิ่นอาหารอื่น ทำให้เสียรสชาจิของอาหาร,เส้นมะละกอ สามารถเปลี่ยนเป็น เส้นแครอทแทนได้ เนื่องจากให้รสชาติแบบเดียวกัน,เคล็ดลับการทำเส้น ให้ใช้ เครื่องขูดเส้น การสับจะได้เส้นที่มีขนาดใหญ่เกินไป และ เส้นไม่ยาว เส้นที่น่ารับประทานต้อง เส้นยาวๆ เส้นเล็กๆ จะได้เข้ากับวุ้นเส้นพอดี,,,,,,,,,,
0,ขนมถั่วทอง,อาหารเจ,เริ่มจากการล้างถั่วเขียวให้สะอาด จากนั้นนำไปแช่น้ำ 3 ชั่วโมง หลังจากแช่น้ำผ่านไป 3 ชั่วโมง คัดถั่วเขียวที่ลอยน้ำออก,จากนั้นนำถั่วเขียวไปนึ่งให้สุก ประมาณ 20 นาที นำถั่วเขียวที่นึ่งมาบดให้ละเอียดจนเป็นผง,ปรุงรสถั่วเขียวโดย ตั้ง กระทะทองเหลือง ใส่ถั่วเขียวบดลงไป ปรุงรสด้วย น้ำกะทิ น้ำตาล เกลือ และ เนื้อมะพร้าวขูด,กวนให้ส่วนผสมละลายเข้ากันทั้งหมด โดยใช้ไฟอ่อนๆ กวนประมาณ 2 ชั่งโมง ให้สังเกตุให้ดูที่เนื้อมะพร้าวขูด จะเป็นผงเนื้อเดียวกับเนื้อถั่วเขียว แสดงว่าได้ที่แล้ว,พักให้ถั่วกวนเย็นจากนั้นนำเนื้อ ถั่วเขียวกวน มา กดบนแม่พิมพ์ เพียงเท่านี้ ก็จะได้ ขนมถั่วทองแสนอร่อย,การเลือกซื้อถั่ว ที่นำมาทำให้เลือกถั่วที่ไม่มีมอดกิน สังเหตุจากถั่วจะไม่มีรอบคราบสีขาวในตัวถั่ว,การล้างถั่ว ต้องล้างให้สะอาด ล้างหลายๆครั้ง จนน้ำที่ล้างถั่วใส แสดงว่าสะอาดแล้ว การล้างถั่วให้สะอาด จะช่วยให้ถั่วที่นำมา ทำให้ขนมไม่มีกลิ่นหืน,แช่ถั่วในน้ำ 3 ชั่วโมง ช่วยให้เนื้อถั่วนิ่ม อมน้ำ เวลานำไปนึ่งจะสุกง่าย หากต้องการให้เร็วขึ้น ก็ใช้น้ำอุ่นจะช่วยรุ่นเวลาให้เร็วขึ้น,น้ำตาล ที่ใช้ในการกวน แนะนำให้ใช้ น้ำตาลปี๊บ จะให้ความหวานแบบหอมธรรมชาติ อร่อยก่วาการ น้ำตาลทราย,ความอร่อยของขนมชนิดนี้ นอกจากเนื้อถั่วที่เนียนแล้ว ความหอมของขนมจะ ช่วยเพิ่มความอร่อยของขนม ให้มากขึ้น ใช้การอบควันเทียน,ให้ใช้ผ้าหมาดๆคลุมขนมไว้ ไม่ให้โดนลม จะ ทำให้ขนมไม่แห้ง น่ารับประทาน,,,,,,,
1,น้ำขิงมะนาว,อาหารเจ,"
","เริ่มจากการต้มน้ำให้เดือด ใส่ขิงลงไปต้ม ประมาณ 15 นาที ด้วยไฟอ่อนๆให้รสชาติและความหอมของขิงค่อยๆออกมา
","เสริฟน้ำขิงร้อนๆ และ ปรุงรสตามใจชอบ ด้วย น้ำผึ้ง และ น้ำมะนาว เพียงเท่านี้ก็ได้น้ำขิงมะนาวร้อนๆ ช่วยให้ร่างกายอบอุ่น แก้หวัด
",,,,,,,,,,,,,,,
