11,หมูย่างดอกดาหลา,ปิ้งย่าง,นำเนื้อหมูมาหมัก กับ รากผักชี กระเทียม พริกไทย ปรุงรสด้วย ซอสปรุงรส และน้ำมันหอย จานนั้นนำไปย่าง ให้สุก จากนั้นนำมาหั่นเป็นชิ้นในจานรอน้ำยำ,เตรียมเครื่องเคียง โดย นำตะลิงปลิง และดอกดาหลา มาแช่ในน้ำเย็นก่อน ให้ดูสดๆ,เตรียมน้ำยำ โดย ใส่ น้ำพริกเผา น้ำตาล น้ำปลา น้ำมะนาว นมจืด และพริกสด มาคลุกให้ส่วนผสมละลายเข้ากัน,จากนั้นใส่ตะลิงปลิง และดอกดาหลาลงไปคลุกกับน้ำยำ,จัดจาน โดย วางไข่ต้มยางมะตูม หมูยาง และน้ำยำที่ผสมดอกดาหลาและตะลิงปลิงบนจาน โรยหน้าด้วย หอมเจียว เสร็จ อาหารยำ เมนูกัลแกล้ม แสนอร่อย,,,,,,,,,,,,,
12,ข้าวหน้าหมูเกาหลี,ปิ้งย่าง,นำ เนื้อหมู ไปหมักด้วยส่วนผสม งาขาว ต้นหอมบด กระเทีบมบด น้ำปลา ซีอิ้วขาว ซอสปรุงรส น้ำมันงา พริกไทยป่น น้ำตาล และ เหล้าจีน จากนั้นนวดให้ส่วนผสมเข้าเนื้อ และนำไปแช่ตู้เย็น 2-3 ชั่วโมง,ตั้งกระทะจากนั้นใส่เนย ลงไป นำหมูที่หมักมาย่างในกระทะให้สุก,จัดจานข้าว เสริฟหมูย่างเกาหลีใส่จาน จัดจานด้วยกิมจิและผักสด ก็พร้อมรับประทาน กับข้าวง่ายๆ เมนูเกาหลี,เมนูหมูเกาหลีราดข้าว ความอร่อยอยู่ที่ การหมักหมู ให้ได้รสชาติหมูเกาหลี,หมู ใช้ หมูสันใน เนื่องจากหมูส่วนนี้ มันน้อย และมีความนุ่ม เวลานำมาหมักได้รสชาติที่อร่อย,การย่างหมู สามารถใช้การย่างบนกระทะแทนการย่างเตาถ่านได้ เนื่องจากข้อจำกัดด้านเวลาและการควบควมการสุกของหมู,,,,,,,,,,,,
13,คอหมูย่าง สูตรน้ำผึ้ง,ปิ้งย่าง,นำ เนื้อคอหมูย่าง มาทุบก่อน จากนั้น นำมาหมักด้วย น้ำผึ้ง ซอสปรุงรส ซอสน้ำมันหอย พริกไทยป่น และ น้ำเปล่า,นำมานวดให้ส่วนผสมทั้งหมดเข้ากันและซึมเข้าไปใน เนื้อหมู หมักทิ้งไว้ 2 ชั่วโมง,นำมา ย่างด้วยไฟอ่อนๆ  เมื่อ หมูสุก ก็นำมาหั่นเป็นชิ้น ทานคู่กับน้ำจิ้มแจ่ว,,,,,,,,,,,,,,,
14,ข้าวหน้าไก่เทอริยากิ,ปิ้งย่าง,หมักไก่ ด้วย แป้งข้าวโพด ซอสโชยุ มิริน น้ำเปล่า น้ำตาล และงาคั่ว จากนั้น หมักให้ซอสทั้งหมดเข้าเนื้อไก่,ตั้งกระทะ นำเนื้อไก่ไป ย่างบนกระทะ ให้สุก ใส่ นำมันนิดหน่อย กันไก่ติดกระทะ,เตรียมข้าวใส่จาน วาง ไก่ย่างเทอริยากิ บนข้าว โรยหน้าด้วย ต้นหอม ข้าวไก่เทอริยากิ,,,,,,,,,,,,,,,
15,Yakitori,ปิ้งย่าง,เริ่มจาก การหมักไก่ นำเนื้อไก่มาหมัก กับส่วนผสม ประกอบด้วย เนย เกลือ พริกไทยดำ น้ำเปล่า กระเทียม ใบมิ้น โรสแมรี่ ใบกระเพรา หมักไว้ในตู้เย็นสัก 2 ชั่วโมง,จากนั้นนำ เนื้อไก่ ไปเสียบไม้ สำหรับย่าง จากนั้นนำไป ย่าง ให้สุกก็พร้อมรับประทาน สูตรยากิโทริ ไก่ย่างสูตรญี่ปุ่น เมนูไก่ กับข้าวจากไก่ เมนูปิ้งย่าง,เนื้อไก่ ที่นำมาทำ ไก่ย่าง ให้เลือกใช้ไก่ที่สดใหม่ เนื้อที่สดใหม่ จะทำให้อาหารอร่อย,กระเทียม ที่ใช้ในการทำ ไก่ย่างยากิโทริ ให้เลือกใช้ กระเทียมจีน เนื่องจาก กระเทียมจีนกลิ่นไม่แรง,ไก่ ก่อนนำมา ย่าง ให้ หมักไว้ก่อน โดยให้นำไปแช่ในตู้เย็น จะทำให้ เครื่องหมัก เข้าเนื้อไก่มากขึ้น,การเลือกซื้อไก่ ไก่ต้องตาใสๆ ไม่ขุ่น ลักษณะของหนังไก่ ไม่เหี่ยวย่น ไม่มีจ้ำเขียว หนังไม่ซีด เนื้อไก่ต้องไม่มีสีเขียว เนื้อแน่น ปลายปีกสามารถดัดงอได้ง่าย หนังไก่มีสีขาว ไม่มีรอยฉีกขาด,,,,,,,,,,,,
16,อกไก่ย่างตะไคร้,ปิ้งย่าง,นำอกไก่ มาหมักกับตะไคร้ เกลือ น้ำตาล ซอสหอยนางรม และ ซอสปรุงรส หมักไว้สัก 30 นาที,จากนั้นนำไปย่าง ให้เหลืองสุก ก็นำมาหั่นจักใส่จานรับประทานได้ อาหารคลีน เมนูอกไก่ กับข้าวง่ายๆ สำหรับคนลดน้ำหนัก,เนื้อไก่ ใช้ส่วนอก เป็นไก่ที่สด ใหม่ ไก่ขนาด 7 ขีด จะเป็นอกไก่ที่มีขนาดพอดี,การย่างให้ใช้ไฟพอดี ไม่แรงหรือเบาเกิน,,,,,,,,,,,,,,
17,คอหมูย่าง สูตรนมสด,ปิ้งย่าง,นำ เนื้อหมู มาทุบก่อน เนื้อจะได้นุ่มและดูดซึมเครื่องหมักได้ดี,นำเนือหมูมาหมัก กับ นมข้นจืด ซอสปรุงรส ซอสหอยนางรม พริกไทย น้ำตาลปี๊บ น้ำเปล่า เกลือ รากผักชี นวดให้ส่วนผสมเข้ากัน และซึมเข้าเนื้อ จากนั้นหมักทิ้งไว้สัก 2 ชั่วโมง,นำมาย่างด้วยไฟอ่อนๆ ให้สุก เมื่อสุกแล้วก็นำมาหั่นใส่จานทานกับน้ำจิ้มแจ่ว กับข้าวง่ายๆ,เนื้อหมู ใช้ส่วน คอหมู ที่มีเนื้อแทรกด้วยมันหมู ส่วนที่มีความนุ่ม ต้องใช้เนื้อหมูที่สด ใหม่ จะทำให้ได้ คอหมูย่าง ที่อร่อย,สูตรคอหมูย่าง ที่อร่อยนั้น นอกจากการหมักเนื้อแล้ว การย่าง ก็เป็นส่วนประกอบที่สำคัญ ซึ่ง สูตรคอหมูย่าง  ต้องใช้ไฟปานกลาง ไม่อ่อน หรือ แรงไป ให้หมั่นกลับเนื้อ จะได้ คอหมูย่าง ที่สุกเท่ากัน,หากว่ากลัว หมูไหม้ ให้ใช้กะทิ ทาที่หมูและย่าง จะช่วยให้หมูไม่ไหม้ได้,,,,,,,,,,,,
18,ไส้กรอกอีสาน,ปิ้งย่าง,ล้างไส้หมูให้สะอาด โดยขั้นตอนนี้สำคัญมาก ต้องล้างไส้หมูให้สะอาด ทั้ง 2 ด้าน ด้านในและด้านนอก โดยมีเคล็ดลับโดยใช้แป้งมันมาทาที่ตัวไส้เพื่อให้ไส้จับตัวไขมัน เวลาล้างไขมันในไส้ถึงออกง่าย,เตรียมไส้ โดย เอาหมูสับ มันหมูสับ ตะไคร้บด เกลือ น้ำตาล พริกไทยขาว พริกไทยดำ ผสมให้ส่วนผสมเข้ากัน จากนั้นนำข้าวสวยมาคลุกกับหมูหมักพักไว้ 30 นาที,นำ หมูหมัก มา ยัดใส่ไส้หมู และเอาด้วยมามัดเป็นท่อนๆ จากนั้นนำ ไส้หมู มาผึ่งแดดอ่อนๆ 1 วัน เราจะได้ไส้กรอกที่หวานอมเปรี้ยว,นำ ไส้กรอกอีสาน ไปย่างไฟให้สุกด้านนอกเหลืองๆไม่ไหม้เกินไป เสริฟ ไส้กรอก แบบอีสาน ทานคู่กับ เครื่องเคียง เช่น กะหล่ำปลี พริกสด,,,,,,,,,,,,,,
19,หมูปิ้ง สูตรกะทิ,ปิ้งย่าง,หั่นเนื้อหมูและมันหมู ความหนาประมาณ 3 มิล และกว้างประมาณ 3 เซ็นติเมตร จากนั้นเตรียมน้ำหมักหมู โดย,ผสม รากผักชี กระเทียม น้ำมันงา น้ำมันหอย ซอสถั่วเหลือง หัวกะทิ น้ำตาล เกลือ และ น้ำมันพืช ให้เข้ากัน จากนั้นนำหมูและมันหมูที่หั่นไว้แล้วลงไปนวด,นวดจนเนื้อหมูและมันหมู ดูดน้ำหมักจนแห้ง จากนั้นเติมแป้งข้าวโพดลงไปนวดกับหมู และนำไปใส่กล่องและแช่ในตู้เย็น 1 คืน,เมื่อหมักหมู 1 คืนแล้ว นำมาเสียบไม้ โดยไม้ที่ใช้เสียบต้องแช่น้ำก่อน 1 คืน เช่นกัน เพื่อให้ไม้อุ้มน้ำเวลาปิ้งไม้จะไม่ไหม้ เสียบหมูโดยให้เนื้อหมูสลับกับมันหมู ให้ได้ขนาดตามที่เราต้องการ เสียบเสร็จก็นำเนื้อหมูเสียบไม้แล้วแช่ในตู้เย็นต่ออีก 1 คืน จากนั้นเราก็สามารถนำมาปิ้ง เป็น หมูปิ้งกะทิ เงินล้านได้แล้ว เคล็ดลับการปิ้งหมูให้อร่อย คือ ใช้ไฟอ่อน ปิ้งหมูให้สุกเป็นด้านๆ อย่าพลิกหมูกลับไปกลับมา แค่นี้ เราก็จะได้หมูปิ้งที่ หวาน อร่อย แล้ว,เนื้อหมูให้หั่นเป็นชิ้นและความหนาที่พอดีไม่หนาหรือบางเกินไป ถ้าบางไปก็จะแข็ง หนาไปก็สุกยากจะไหม้,เนื้อหมูให้ใช้เนื้อหมูที่สดใหม่ เป็นเนื้อหมูสันใน เนื่องจากเนื้อหมูสันในมีความนุ่มและไขมันน้อย,ขั้นตอนการหมักหมูก่อนนำมาเสียบไม้ เป็นขั้นตอนที่สำคัญ ต้องพิถีพิถันให้มากที่สุด,ไม่เสียบลูกชี้นส่วนใหญ๋เวลานำไปย่างจะไม้ สามารถแก้ไขได้ด้วยการ นำไม่เสียบลูกชี้นไปแช่น้ำก่อน 1 คืน ให้ไม่ไผ่อิ่มน้ำ เวลาโดนความร้อนไม้จะไม่ไหม้,ถ่านและความร้อนของไฟในการย่างมีผลต่อเนื้อหมู ต้องใช้ไฟอ่อนๆ และหมั่นกลับไม้ จะได้เนื้อหมูที่สุก พอดี ไม่ไหม้ หรือดิบ น้ำซอสจากการหมักหมูจะอกมาชุ่มฉ่ำให้ความอร่อย,การเก็บหมูปิ้งที่ปิ้งเสร็จแล้ว ให้เก็บในที่ๆไม่มีลม หากสามารถรักษาความร้อนไวได้จะดีที่สุด,การปิ้งหมูปิ้งนั้น หากไม่อยากให้หมูปิ้งไหม้ สามารถใช้กะทิทาที่หมูจะช่วยให้หมูไม่ดำจากการโดนไหม้,,,,,,,
20,พุลโกกิ,ปิ้งย่าง,การหมักเนื้อวัว ใช้เวลาประมาณ 3 ชั่วโมง โดยใส่ส่วนผสม ประกอบด้วย เนื้อวัว หอมใหญ่ ต้นหอม ขิง กระเทียม น้ำตาล ซอสถั่วเหลือง และ พริกไทยดำ หมักไว้ตามเวลาที่กำหนด,ตั้ง เตาย่าง อย่่าให้ไฟร้อนเกินไปใช้ ไฟปานกลาง นำเนื้อที่หมัก และ ผักสด ไปย่าง ให้สุกตามใจชอบของผู้ย่าง,เสริฟ พลุโกกิ ทานกับ น้ำจิ้มเกาหลี,เนื้อวัว เลือก เนื้อวัว ที่สด สะอาด โดย การเลือกซื้อเนื้อวัว สามารถทำได้โดย ให้ เลือกเนื้อวัว สีสดๆ เนื้อแน่น มีความเด้งตึง ไม่มีสีคล้ำ ไม่มีกลิ่นเหม็น,เนื้อวัว เทคนิคในการทำให้เนื้อนุ่ม ให้ หั่นเนื้อตามขวางกับลายเนื้อ จะทำให้ เนื้อวัวไม่เหนียวเป็นเส้น,การย่างเนื้อ เคล็ดลับในการย่าง อยู่ที่การใช้ไฟ และ การควบคุมอุณหภูมิของไฟ ให้พอดี ไม่อ่อน หรือ แรงเกินไป ไฟอ่อน เนื้อจะสุกยาก ไฟรแรงไป เนื้อจะไม่สุกถึงข้างใน และไหม้ก่อน,กระเทียม สำหรับ ใช้ใน การหมักเนื้อวัว ใช้กระเทียมเม็ดใหญ่ เป็น กระเทียมจีน เนื่องจาก กลิ่นของกระเทียม ไม่แรงเกินไป เหมาะสำหรับหมักเนื้อวัว,พริกไทย ในการหมัก ใช้ พริกไทยดำ เนื่องจากพริกไทยดำ เหมาะสำหรับนำมาหมักเนื้อวัว กลิ่นของพริกไทยแรง รสเผ็ดของพริกไทย ช่วยตัดความมันได้ดี เรียกว่า เนื้อวัวจะหอม และ มัน,,,,,,,,,,
21,ข้าวหน้าไก่,ปิ้งย่าง,นำเนื้อไก่มาหมัก กับ มิริน ซอสถั่วเหลือง สาเก น้ำตาล จากนั้นนำไปย่างในกระทะ เมื่อสุกให้เทน้ำซอสที่ได้จากการย่างไก่ในกระทะไปเป็นน้ำปรุงไข่,ตอกไข่ ใส่น้ำซอสไก่ย่าง ใส่หอมใหญ่ จากนั้นนำไปราดไก่บนกระทะ และอบไว้สักครู่ให้ไข่สุกๆดิบๆ ให้มีความชุ่มของน้ำไข่หวานซอสจากไก่ย่าง,นำไปราดข้าว โรยหน้าด้วยต้นหอม เสริฟโอยาโกะด้ง กับข้าว เมนูไก่,Dashi 3 tablespoon,sugar 2 teaspoon,Sake 2 teaspoon,soy sauce 1 tablespoon,Mirin 2 teaspoon,onion thinly sliced 2 tablespoon,chicken thigh sliced 1 dish,egg 1 egg,green onion sliced 1 teaspoon,Japanese rice 1 dish,,,,,
22,หมูปิ้ง,ปิ้งย่าง,นำหมูมาหมัก กับซอสหอยนางรม ซอสถั่วเหลือง น้ำปลา น้ำตาล แป้งมัน น้ำมันพืช และรากผักชี กระเทียม พริกไทย หมักไว้ 2-3 ชั่วโมง,นำเนื้อหมูมาเสียบใส่ไม้ลูกชิ้น สำหรับปิ้ง,นำเนื้อหมูใส่ไม้ปิ้งด้วยไฟอ่อนๆ,หมูปิ้ง ที่ไม่ให้ไม่เสียบหมูปิ้งไหม้เวลา ย่างให้นำไม้ไปแช่น้ำก่อน 1 คืน ให้ไม้อิ่มน้ำ แล้วเวลาโดนความร้อนแล้วไม้จะไม่ไหม้,หมู ให้ใช้ หมูสดๆ ใหม่ เนื้อหมูจะมีความอร่อยกว่าหมูที่ค้างคืน,เนื้อหมู ให้ใช้ส่วน สันในหมู เนื่องจากส่วนนี้เนื้อจะนุ่ม หากย่างอย่างถูกวิธี ก็จะได้หมูที่นุ่มอิ่มน้ำซอส,ไฟที่ใช้ใน การย่างหมู ให้ใช้ไปอ่อนๆ ให้หมูค่อยๆสุก หมูจะไม่ไหม้,หากไม่ต้องการให้หมูไหม้ ให้ ทากะทิ ที่หมูจะ ช่วยให้ใหม่มีความมันและไม่ดำ,,,,,,,,,,
23,ปลาซาบะย่างซีอิ๋ว,ปิ้งย่าง,เตรียมทำน้ำซอสสำหรับหมัก และ ย่างปลาซาบะ โดยตั้งกระทะสำหรับทำน้ำซอส ใส้น้ำตาลลงไปเคี้ยวให้เป็นสีน้ำตาล จากนั้น ปรุงรสด้วย สาเก และ ซิอิ้วญี่ปุ่น หรือ ซอสโชยุ เคี้ยวให้เหนียวก็สามารถรับประทานได้,หมักปลาซาบะ กับซอสทาริยากิ ให้หมักทิ้งไว้ประมาณ 15 นาที หมักในตู้เย็น เมื่อได้ตามเวลาที่ต้องการ ให้นำไปย่างได้,การย่างปลาซาบะ เราจะย่างในกระทะ เพราะต้องการเก็บน้ำซอสจากการย่างเอาไว้ ตั้งกระทะสำหรับย่าง ใส่น้ำมันนิดหน่อยพอให้ไม่ติดกระทะ นำปลาลงไปย่าง ไฟอ่อนๆ ย่างให้สุกเหลือง ทั้งสองด้าน,เสริฟ ปลาย่างซือิ้ว กับ ขิงดองซอย และ วาซาบิ ราดด้วยน้ำที่ได้จากการย่างปลา ทานกับ น้ำจิ้มทาริยากิ และ ข้าวญี่ปุ่นร้อนๆ,ปลาซาบะ ต้องเลือกปลาซาบะที่สดใหม่ การสังเกตุปลาสดๆ ให้ดูที่ ความสมบูรณ์ของตัวปลา ตาปลาซาบะใส เหงือกแดง หนังตึง เนื้อแน่น ไม่มีกลิ่นเน่า,การแล่เนื้อปลา ให้แล่ตามแนวก้ากปลา จะทำให้ได้เนื้อปลาที่ไม่ก้างปลาติดออกมาด้วย,เทคนิคการย่างปลาซาบะ เราใช้กระทะในการย่าง การย่างปลาไม่ต้องกลับปลาบ่อย ให้สุดครึ่งตัว และ จึงกลับด้าน เนื้อปลาจัสุกและหนังกรอบ หอมและ หวานซอสที่มีกลิ่นของปลา ไม่ต้องใส่น้ำมันมา เพราะจพทำให้มันเกินไป,การกินปลาซาบะย่าง ต้องกินขณะที่ปลาร้อนๆ เนื่องจากปลาที่ร้อนๆอยู่ นั้นเนื้อปลาจะนุ่ม และ ชุ่มน้ำ หากปล่อยให้ปลาเย็น และแห้ง เนื้อปลาจะแข็ง และไม่ชุ่มน้ำซอส จะไม่น่ารับประทาน,,,,,,,,,,
