91,ผัดไทยกุ้งสด,ผัด,เริ่มจากการเตรียมซอสผัดไทย ก่อน โดยการผสม ซอสหอยนางรม น้ำตาลปี๊บ น้ำปลาและน้ำมะขามเปียก ผสมให้ส่วนผสมเข้ากัน,ล้างกุ้งให้สะอาด นำมาแกะเปลือก ผ่าเส้นที่หลังออก และนำไปลวกในน้ำร้อนจัด และนำเอามาพักเอาไว้ก่อน,เริ่มจากการใส่น้ำมัน 2 ชั้นโต้ะ ใส่หอมแดงและหัวไชโป้วลงไปผัด ให้หอมแดงเริ่มหอม ก็ใส่เส้นลงไปผัด เติมน้ำลงไปนิดหน่อยให้สามารถผัดเส้นให้สุกได้,จากนั้นใส่ซอสผัดไทยลงไป 2 ช้อนโต้ะต่อ 1 จาน ผัดให้เส้นเข้ากัยซอส,เมื่อเส้นเริ่มนุ่ม ให้ใส่ เต้าหู้ ใบกุยฉ่ายและถั่วงอกลงไปผัด ผัดต่อไปเรื่อยๆ จากนั้นให้ขยับส่วนของเส้นไว้ด้านข้างกระทะให้เหลือตรงกลางเอาไว้ เพื่อจะทอดไข่,ใส่น้ำมันตรงกลางกระทะ ตอกไข่ลงไป เกรี่ยให้ไข่เป็นแผ่นจากเมื่อไข่สุก ให้นำมาผัดให้เข้ากับเส้นที่เราผัดเอาไว้แล้ว ปิดไฟ,เสริฟใส่จาน โรยหน้าด้วย กุ้งลวก ถั่วลิสงคั่ว พริกป่น มะนาว และทานคู่กับผักอย่าง ถั่วงอก ต้นหอม และ หัวปลี,การเลือกใช้เส้น สำหรับ เมนูผัดไทย ต้องเลือกใช้เส้นจันทร์ เป็นเส้นกลาง จะมีขนาดใหญ่กว่าเส้นเล็ก เส้นจากจันทบุรีมีคุณสมบัติเด่น คือ ความเหนียวนุ่ม ไม่เละ,เคล็ดลับความอร่อยของผัดไทย คือ น้ำซอสปรุงรส ที่มีส่วนผสมของน้ำตาลปี๊บและน้ำมะขามเปียก ให้ปรุงน้ำซอสเอาไว้ก่อนได้เวลาผัดจะได้เข้าเส้นเร็วและรสชาติเสมอกัน,การเลือกถั่วงอก ให้เลือกถั่วงองที่มีลักษณะขาวอวบ ซึ่งจะมีความกรอบหวานอร่อยน่ารับประทาน,กุ้งแห้ง จะใส่ก็ได้ หรือ ไม่ใส่ก็ได้ แต่หากจะใส่กุ้งแห้ง ให้เลือกใช้กุ้งแห้งเกรดเอจากเยาวราช เป็นกุ้งแห้งตัวใหญ่ โดยให้ล้างให้สะอาด เอาสีและสิ่งสกปรกออกจากกุ้งก่อน และนำมาอบให้แห้งอีกครั้งหนึ่งจึงได้กุ้งแห้งที่น่ากิน,กุ้งสด สำหรับนำมาทำผัดไทย ให้เลือกกุ้งขนาดพอดี หรือ ตามใจชอบ แต่ไม่ใหญ่หรือเล็กเกินไป ต้องเลือกกุ้งที่สดๆ ใหม่ โดยให้สังเกตุ กุ้งต้องมีความสมบูรณ์ หัวไม่หลุก เปลือกไม่ลอก เนื้อกุ้งแน่น ไม่มีกลิ่นเน่า เมื่อได้กุ้งมาแล้วให้ล้างให้สะอาด เกะเปลือก ผ่าหลังออก และนำเอาไปลวก นำมาทานคู่กับผัดไทย,,,,,,
92,กุ้งผัดพริกเผา,ผัด,ตั้งกระทะน้ำมันให้ร้อน นำเนื้อกุ้งลงไปผัด ให้สุก จากนั้นนำเนื้อกุ้งลงมาพักไว้ก่อน,ใส่พริกและกระเทียมบดลงไปผัด ให้หอม จากนั้นใส่น้ำพริกเผาลงไปผัด ปรุงรสด้วย น้ำตาลและน้ำปลา,ใส่หอมใหญ่ ต้นหอม พริกชี้ฟ้าซอย ใบโพระพา และ กุ้งลงไปผัด ผัดให้หอมใหญ่สุด ก็สามารถเสริฟได้ หากน้ำแห้งเกินให้เติมน้ำเปล่าลงนิดหน่อย,เสริฟ กุ้งผัดน้ำพริกเผา ทานกับข้าวหอมมะลิร้อนๆ กับข้าว แบบง่ายๆ เมนูกุ้งผัด,กุ้งให้เลือกกุ้งสดๆ โดย การเลือกกุ้งที่สดๆ ให้ดูสีของกุ้งไม่มีสีเหลือง หรือ ออกเน่า ไม่มีกลิ่นเน่า เนื้อกุ้งแน่น ลักษณะของเปลือก ติกกับตัวดี หัวไม่หลุดจากตัวกุ้ง เมื่อซ่ื่้อกุ้งมาแล้วให้ล้างให้สะอาด แกะหัว ปลอกเปลือก และผ่าหลังออก สำหรับเมนูนี้ให้เอาหัวออก เนื่องจากหัวกุ้งมีมันกุ้งอยู่ หากนำมาผัดมันกุ้งจะออกมาทำให้อาหารเสียรสชาติ,เนื้อกุ้ง เป็นเนื้อที่สุกง่าย หากผัดนานเกินไปกุ้งจะแข็งกระด้างและหมดความหวาน ไม่น่ารับประทาน,เทคนิคการผัดกุ้ง ให้นำกุ้งลงไปทอดก่อน จะได้เนื้อกุ้งที่กรอบ เคี้ยวกรุบๆ อร่อยน่ารับประทาน,พริกให้ใช้พริก 2 แบบ คือ พริกบด และ พริกหั่นเฉียงๆ พริกบด จะให้ความหอมและรสชาต ส่วนพริกหั่นเฉียงๆ จะให้สีสันสวยงาม,ใบโหระพา สามารถใส่ลงไปผัดขั้นตอนสุดท้ายได้ เพราะ หากผัดใบโหระพานานเกินไป จะทำให้กลิ่นของใบโหระพา หายไปหมด ไม่น่ารับประทาน,น้ำตาล เราเลือกใช้ น้ำตาลปี๊บ เนื่องจากความหวานของน้ำตาลปี๊บ หวานหอม อร่อย,กระเทียม ให้เลือกใช้กระเทียมไทย จะให้ความหอมของอาหาร,ต้นหอม ต้องหั่นยาวๆ หากหั่นเล็กๆ สีสัน และ กลิ่นของต้นหอมจะทำให้อาหารเสียรสชาติ,หอมใหญ่ เวลาซอย ไม่ซอยเล็กหรือใหญ่เกินไป ซอยให้ได้ขนาดพอดี เพราะ หากซอยเล็กเกิน เวลาผัดโดนความร้อนหอมใหญ่จะลาลายหมด หากซอยใหญ่เกินไปขนาดไม่พอดีคทานยาก,สำหรับคนที่ไม่ชอบกุ้ง สามารถเปลี่ยนใช่วัตถุดิบ อื่นๆ ได้ เช่น ไก่ ปลาหมึก หรือ หมู นำมาทำผัดพริกเผาก็อร่อย หรือ จะเอาแบบซีฟู๊ด เลยก็ได้,,,,
93,ดอกขจรผัดไข่กุ้งสด,ผัด,"
","ต้มน้ำเดือด จากนั้น นำดอกขจรไปลวกไม่ต้องลวกนาน จากนั้นนำไปแช่น้ำเย็น เพื่อรักษาความสดของดอกขจร
","นำเนื้อกุ้งล้างให้สะอาด ตัดหัว แกะเปลือก และ ผ่าเส้นที่หลังออก จากนั้นนำไปลวกให้พอสุก ให้เปลี่ยนน้ำ เนื่องจากจะทำให้กุ้งมีกลิ่นของอาหารอื่น
","นำกุ้งแห้งไปลวกในน้ำร้อน ให้กุ้งนุ่มและ คลายความเค็ม จากนั้นพักเอาก่อน
","นำวุ้นเส้นไปแช่น้ำให้เส้นมีความชื้น จากนั้น นำมาพักเอาไว้ก่อน เพื่อเตรียมนำไปผัด
","ตั้งกระทะน้ำมันให้ร้อน จากนั้นตอกไข่ลงไปผัด ตามด้วยวุ้นเส้น
","ใส่ดอกขจร เห็ดหูหนู กุ้งแห้ง และ กุ้งลวกลงไปผัด
","ปรุงรสด้วย น้ำตาล ซอสน้ำมันหอย และ ซอสถั่วเหลือง
","ผัดให้เส้นสุก ก็นำขึ้นมาเสริฟใส่จาน พร้อมสำหรับรับประทาน
",,,,,,,,,
94,ผักบุ้งผัดกะปิกุ้งสด,ผัด,"
","เตรียมเนื้อกุ้ง โดยการแกะเปลือก ผ่าเส้นที่หลังออก ตัดหัว จากนั้นพักเอาไว้ก่อน
","เตรียมผักบุ้ง โดยใช้ส่วนก้านของผักบุ้ง นำมาซอยเป็นเส้นๆ ขนาดพอดีคำ จากนั้นนำมาลวกให้น้ำเดือด ประมาณ 1 นาที จากนั้นนำมาแช่น้ำเย็น ให้ผักบุ้งคงความสด
","เตรียมกะปิ โดยน้ำกะปิมาโขรกกับหอมแดงให้ส่วนผสมเข้ากัน จากนั้นนำมาพักเอาไว้ก่อน
","เริ่มจากตั้งกระทะน้ำมันให้ร้อน จากนั้นนำกระเทียมลงไปเจียวให้เหลือง เมื่อกระเทียมเหลืองให้ใส่กุ้งลงไปผัด
","ตามด้วยกะปิที่เตรียมไว้ ผัดให้กุ้งและกะปิหอม ขั้นตอนนี้ต้องผัดให้กะปิหอมเลย ไม่เช่นนั้นกะปิจะคาว
","จากนั้นใส่น้ำตาลปี๊บลงไปผัด เมื่อน้ำตาลละลาย ให้ใส่เส้นผักบุ้งที่ลวกไว้ลงไปผัด
","ปรุงรสด้วยน้ำปลา ผัดให้เส่วนผสมเข้ากัน ก็สามารถเสริฟใส่จาน โรยหน้าด้วยพริกซอย ก็สามารถรับประทานได้
",,,,,,,,,,
95,ข้าวผัดน้ำพริกเผา,ผัด,"
","เริ่มการทำข้าวผัดโดยการนำข้าวหุงสุกไปทำให้เย็นก่อน โดยแช่เย็นไว้สัก 1 ชั่วโมง จากนั้น นำข้าวสวยมาคุลกกับน้ำพริกเผา คลุกเคล้าให้ทั่ว ขั้นตอนนี้ ทำเบาๆ อย่าให้ข้าวเละ
","จากนั้นตั้งกระทะน้ำมันให้ร้อน จากนั้น ผัด กุ้ง กระเทียม และ หอมแดง ให้มีกลิ่นหอมและ หอมแดงเริ่มเหลือง ก็นำข้าวคลุกน้ำพริกเผาลงไปผัด การผัดข้าวไม่ต้องขยี้ข้าว ให้คลุกไปคลุกมาก็พอ เวลาข้าวโดนความร้อนจะแตกตัวออกมาเอง
","จากนั้น ใส่ พริกขี้หนูสวน ลงไปผัด และ ปรุงรสด้วย น้ำตาล ซอสหอยนางรม ซอสปรุงรส ผัดให้ส่วนผสมและเครื่องปรุงเข้ากัน
","เสริฟข้าวผัดใส่จาน จัดหน้าจานด้วย ผักชี และ แตงกวา ทานคู่กับ พริกน้ำปลา
",,,,,,,,,,,,,
96,เมล่อนกุ้งผัดไข่,ผัด,"
","เริ่มจากการนำเมล่อนไปนึ่งให้สุกก่อน เนื่องจากเนื้อเมล่อนเขียวจะแข็ง ต้องหากนำมาผัดเลยจะสุกยาก และ อาจทำให้เละไม่น่ารับประทาน ให้นำไปนึ่งประมาณ 30 นาที ให้เนื้อเมล่อนนุ่มรับปรุทานได้ จากนั้นนำมาพักให้เย็นก่อน
","จากนั้น ต้องกระทะน้ำมัน ให้ร้อนปานกลาง ใส่กระเทียมลงไปผัดให้เริ่มเหลือง จากนั้นใส่กุ้งลงไปผัด
","ปรุงรสด้วย น้ำตาล น้ำปลา และซอสหอยนางรม ผัดให้ส่วนผสมเข้ากัน จึงนำไข่ลงไปผัด
","เมื่อไข่เริ่มสุกได้ที่ให้นำเมล่อนลงไปคลุกกับอาหารในกระทะ ให้เข้ากัน
","เสริฟใส่จาน พร้อมรับประทาน
",,,,,,,,,,,,
97,ข้าวผัดมันกุ้ง,ผัด,ตั้งกระทะน้ำมัน ใส่ น้ำมันหมู ลงไปผัด ใส่  กระเทียม รากผักชี และ มันกุ้ง ลงไปผัด,จากนั้นใส่ เนื้อกุ้ง ลงไปผัด พอเริ่มสุก ให้ใ่ส ข้าว ลงไปผัด,ปรุงรสด้วย น้ำตาล และ ซอสปรุงรส,ผัด ให้ส่วนผสมเข้ากัน เสริฟใส่จาน และ จัดจานด้วย แตงกวา ผักชี และ พริกไทยป่น ทานคู่กับพริกน้ำปลา,,,,,,,,,,,,,,
98,ข้าวผัดต้มยำแห้งทะเล,ผัด,ตั้งกระทะน้ำมัน เอากระเทียม รากผักชี และ พริกไทย ลงไปผัด พร้อมกับ หอย กุ้ง และ ปลาหมึก ผัดให้สุกจากนั้นตอกไขลงไป ผัด ต่อผัดให้ไข่สุกและแห้ง,ใส่ ข้าว ลงไปผัดให้เข้ากับส่วนผสม จากนั้นปรุงรสด้วย เกลือ น้ำตาล และ น้ำมะนาว,ใส่ พริกสด ตะไคร้ซอย และ ใบมะกรูดซอย ลงไปผัด เสริฟ ข้าวผัดต้มยำแห้งทะเล,,,,,,,,,,,,,,,
99,กุ้งผัดสะตอพริกแกงใต้,ผัด,ตั้งกระทะน้ำมันให้ร้อน นำกุ้งลงไปผัดให้สุก จากนั้นใส่พริกแกงใต้ลงไปผัดให้สุก,ปรุงรสด้วย น้ำตาลและน้ำปลา ใส่สะตอลงไปผัด เติมน้ำลงไปนิดหน่อย,ผัดต่อให้สะตอสุก เสริฟใส่จาก พร้อมรับประทาน กับข้าวง่ายๆ เมนูผัด,,,,,,,,,,,,,,,
100,ข้าวผัดผงกะหรี่ทะเล,ผัด,เริ่มจากหุงข้าวให้สุกก่อน จากนั้นนำไปแช่ตู้เย็นก่อน 1 คืน ให้ข้าวแข็งตัว,เตรียมเนื้อสัตว์ โดยตั้งน้ำร้อน ลวก กุ้ง ปลา และ ปลาหมึกให้สุกก่อน และ นำมาพักเอาไว้ก่อน,เริ่มผัด โดยตั้งกระทะน้ำมันให้ร้อน ตอกไข่ลงไปผัด จากนั้นปรุงรสด้วย น้ำตาลทราย เกลือ ซอสถั่วเหลือง นมสด และ ผงกะหรี่,ใส่หอมหัวใหญ่ ต้นหอม ลงไปผัด ให้สุกก่อน,ใส่ข้าวหอมมะลิลงไปผัด ผัดไปเรื่อยๆ ไม่ต้องขยี้ข้าว เมื่อส่วนผสมเข้ากับข้าว และ ข้าวแตกตัวเป็นเม็ดสวยแล้ว,ใส่เนื้อสัตว์ที่เตรียมเอาไว้ลงไปผัด ปิดไฟ เสริฟใส่จาน ทานคู่กับพริกน้ำปลา และ แตงกวา กับ ต้นหอม,,,,,,,,,,,,
101,ผัดกระเพรากุ้ง,ผัด,ต้มน้ำให้เดือด จากนั้นเอา กุ้ง ไปลวกก่อน การลวกกุ้งในน้ำเดือดก่อน จะ ทำให้กุ้งไม่คาว จากนั้นตั้งน้ำมันในกระทะจนร้อน จากนั้นใส่ กระเทียม พริก ลงไปผัดประมาณ 5-10 วินาที ผัดจนกลิ่นเริ่มหอม จากนั้น ใส่กุ้งลงไปผัด,จากนั้นปรุงรสด้วย ซอสน้ำมันหอย ซอสถั่วเหลือง น้ำตาล น้ำปลา น้ำซุปนิดหน่อย และใส่ ใบกะเพรา ลงไปในกระทะ ผัดให้ส่วนผสมเข้ากัน,"เสริฟ ผัดกระเพรากุ้ง ทานกับ ข้าวหอมมะลิ ของไทย หากให้อร่อยต้องมีไข่ดาวด้วย ทานคู่กับพริกน้ำปลา
",เนื้อกุ้ง ต้องใช้เนื้อกุ้งที่สดใหม่ วันต่อวัน ล้างให้สะอาด แกะเปลือก เมือกที่ตัวกุ้งจะเป็นส่วนที่ ทำให้กุ้งมีความคาว เสียรสชาติความอร่อย,ใบกระเพรา ที่ใช้ในการ ผัดใบกระเพรา ให้ใช้ ใบกระเพราแดง ซึ่งเป็น กระเพรา พันธ์ที่มีกลิ่นหอม ใบเล็ก นำมาทำ ผัดกระเพรา หอมอร่อย,พริกสด ให้ใช้ พริกขี้หนูสวน ผสมกับ พริกชี้ฟ้า จะทำให้รสเผ็ดและสีสันสวยงาม,กระเทียม ใช้ กระเทียมไทย ซึ่ง กระเทียมไทย จะมีความหอม มากกว่า กระเทียมจีน,การผัดกุ้ง อย่าผัดนานเกินไป เนื่องจาก กุ้ง หากสุกเกินไป เนื้อกุ้งจะแข็ง และไม่หวาน,สำหรับคนที่ไม่ชอบกินเผ็ด ก็สามารถเอาพริกออก ได้ โดยไม่ต้องใส่พริกลงไปผัด แต่ รสชาติของผัดกระเพราะ จะออกเค็มๆ แต่รสชาตินั้น ขึ้นอยู่กับคนทำ ว่า อยากให้ผัดกระเพราของเรามีรสชาติ อย่างไร ไม่ชอบกินเผ็ด ก็ ไม่ต้องใส่พริก,,,,,,,,,
102,ผัดกุ้งกับซอสหวาน,ผัด,ตั้งกระทะน้ำมันให้ร้อน นำ ขิง กระเทียม กุ้ง และ แครอท ลงไปผัด จากนั้น ปรุงรสด้วย น้ำตาล ซอสถั่วเหลือง ซอสมะเขือเทศ เหล้าจีน น้ำส้มสายชู และ น้ำเปล่า,ตามด้วย พริกหยวก จากนั้น ใส่ แป้งข้าวโพด ลงไปผัด ให้ซอสเหนียว ก็สามารถเสริฟใส่จาน พร้อมรับประทานได้ กุ้งผัดซอสหวาน,กุ้ง ใช้ กุ้งตัวใหญ่ พอดี ต้องเป็น กุ้งสดๆ ใหม่ สะอาด,ล้างกุ้งให้สะอาด อย่าให้เหลือเมือก เนื่องจากจะ ทำให้เนื้อกุ้งคาว,กุ้ง ไม่แนะนำให้ผัดนาน อย่าทำให้เนื้อกุ้งสุกเกินไป เนื่องจาก เนื้อกุ้งจะแข็ง และไม่อร่อย,กุ้ง หากเลือก กุ้งตัวใหญ่ๆ ทำให้อร่อยมากขึ้น,,,,,,,,,,,,
